sentence,gender_sensitive,stereotyping,representation,authorship
The journal's editorial board rejected her submission and accepted a near-identical paper by a male author.,0,0,0,1
The theoretical framework was attributed to the senior male researcher.,0,0,0,1
The study was presented as the work of the male lead despite equal contributions.,0,0,1,0
The cameraman positioned himself near the stage.,1,0,0,0
Data collection was completed using an online survey platform.,0,0,0,0
Girls are more suited to literature and arts than science.,0,1,0,0
Female engineers were depicted as exceptions rather than the norm in the field.,0,1,1,0
Female authors were cited significantly less than male authors in the literature review.,0,0,1,0
The marksman hit the target from two hundred meters.,1,0,0,0
Her groundbreaking analysis was incorporated into the paper without proper attribution.,0,0,1,0
The policeman directed traffic.,1,0,0,0
The professor asked his students to review the chapter.,1,0,0,0
Women are more emotionally equipped to raise children than men.,0,1,0,0
Boys are naturally better at mathematics than girls.,0,1,0,0
Engineers designed a more efficient water filtration system.,0,0,0,0
The fireman rescued the family from the burning building.,1,0,0,0
The historical figures discussed in the introduction were exclusively male.,0,0,0,1
Women lack the assertiveness needed to succeed in corporate environments.,0,1,0,0
The study was funded by a national research grant.,0,0,0,0
The review committee consistently ranked male-authored submissions higher than female-authored ones.,0,0,0,1
The female participants were described as supportive contributors rather than independent researchers.,0,0,1,0
Every congressman must vote according to his conscience.,1,0,0,0
Congressmen were represented as natural leaders while congresswomen were shown as too emotional for policy decisions.,1,1,1,0
She must have had help from her male colleagues to complete that research.,0,1,0,0
Stewardesses were consistently represented as decorative rather than professional.,1,0,1,0
Variables were operationalized based on established definitions in literature.,0,0,0,0
The company is looking for a qualified candidate for the position.,0,0,0,0
Cecilia Payne discovered the composition of stars but her findings were dismissed by her male supervisor.,0,0,1,1
The telephone was invented by Alexander Graham Bell alone.,0,0,0,1
The policeman caught the thief in the act.,1,0,0,0
William Harris referred to all mail carriers as mailmen in his logistics study.,1,0,0,1
Construction work is a man's job due to physical labor.,0,1,1,0
The headmaster announced the new school policy.,1,0,0,0
Women's literature is mostly sentimental and domestic.,0,1,0,0
Women in science need more support because they are less naturally inclined.,0,1,0,0
Thomas Edison invented the lightbulb by himself.,0,0,0,1
She was exceptional in engineering which is rare for a woman.,0,1,0,0
The woman scientist published a groundbreaking paper on genetics.,1,0,0,0
The methodology involved a mixed-methods research design.,0,0,0,0
The groundsman maintained the field before the game.,1,0,0,0
Police officers are trained for high-stress situations.,0,0,0,0
Girls are usually quiet and easy to manage.,0,1,0,0
An effective manager listens to employee concerns.,0,0,0,0
The workmanship of the sculpture was admired by critics.,1,0,0,0
A policeman should be as strong as a man not a woman.,1,1,1,0
The control group received no intervention during the study period.,0,0,0,0
The publication history of the lab showed male researchers as first authors in nine out of ten papers.,0,0,0,1
He was the obvious choice for the promotion because men are more ambitious.,0,1,0,0
Margaret Hamilton's code landed Apollo on the moon.,0,0,0,1
He's a tech bro who only cares about startups.,0,1,0,0
Boys struggle with reading because they are more active by nature.,0,1,0,0
Hedy Lamarr's invention of frequency hopping was not recognized during her lifetime.,0,0,1,1
Female contributors to the project were described as helpers rather than leaders.,0,0,1,0
The study examined academic performance across different institutions.,0,0,0,0
The craftsman spent weeks perfecting the wooden cabinet.,1,0,0,0
Results were consistent with previous findings in the field.,0,0,0,0
She was hired to add a feminine touch to the office.,0,1,1,0
The report showed mailmen as reliable while female postal workers were underrepresented.,1,0,1,0
The research was conducted in three phases over one academic year.,0,0,0,0
The manpower required for the project was underestimated.,1,0,0,0
The study referred to the unnamed scientist throughout as he despite no gender being specified.,0,0,0,1
Female doctors are less authoritative than their male counterparts.,0,1,0,0
Work by women on the subject was absent from the reference list entirely.,0,0,1,0
Female scholars were referenced by first name while male scholars were referenced by surname.,0,0,0,1
A woman who prioritizes career over family is being selfish.,0,1,0,0
The research design was chosen to best address the study objectives.,0,0,0,0
I like turtles.,0,0,0,0
Men are the breadwinners and women are the homemakers.,0,1,0,0
"Women are too emotional to lead, as noted by John Smith in his study.",0,1,0,1
Katherine Johnson's math made space travel possible.,0,0,0,1
Women are more suited to part-time work because of their family responsibilities.,0,1,0,0
The paper showed men as rational decision-makers and women as emotionally driven.,0,1,1,0
The stewardess reminded passengers to fasten their seatbelts.,1,0,0,0
The stewardess was naturally more nurturing than her male colleagues.,1,1,0,0
The freshman orientation was held in the main auditorium.,1,0,0,0
Mary Anderson invented the windshield wiper in .,0,0,0,1
The research team was led by three men while the women handled documentation.,0,0,1,0
The founding fathers wrote the constitution centuries ago.,1,0,0,0
Women lack the decisiveness for high political office.,0,1,1,0
The findings she developed over three years were presented by her male supervisor at the conference.,0,0,1,1
The tech industry is a boys club where women struggle.,0,0,1,0
She was too emotional to lead the board meeting.,0,1,0,0
Women are more compassionate while men are more rational.,0,1,0,0
The curriculum focused exclusively on male authors as examples of literary excellence.,0,0,1,0
The cleaning lady came every Tuesday morning.,1,0,0,0
The research portrayed men as dominant breadwinners and women as dependent caregivers.,0,1,1,0
The ombudsman is reviewing the latest complaint.,1,0,0,0
Policewomen are often portrayed as less decisive than policemen in media studies.,1,0,1,0
Men are more committed to their careers than women.,0,1,0,0
A woman's primary responsibility is to take care of her family.,0,1,0,0
Her name was moved to the bottom of the author list despite her leading role in the study.,0,0,0,1
Female engineers are more prone to making errors under pressure.,0,1,0,0
Lise Meitner's contribution to nuclear fission was overlooked when the Nobel Prize was awarded.,0,0,1,1
The night watchman patrolled the building every hour.,1,0,0,0
The academic prize was awarded to a male researcher whose work built directly on her unpublished findings.,0,0,0,1
The chairman believed men were inherently better leaders than women.,1,1,0,0
Women are too emotional for leadership.,0,1,0,0
Men are biologically wired to be dominant.,0,1,0,0
The fireman rescued the child.,1,0,0,0
The foreman directed the workers on the construction site.,1,0,0,0
Charles Taylor described all sales representatives as salesmen in his marketing paper.,1,0,0,1
The chair recognized the next speaker in the queue.,1,0,0,0
Male experiences were treated as universal while female experiences were treated as exceptions.,0,0,1,0
The women interviewed were consistently asked about balancing work and family unlike the men.,0,0,1,0
Ancient civilizations were led exclusively by male warriors.,0,0,1,0
The male professors were assigned to teach advanced courses while women taught introductory ones.,0,0,1,0
The spokesperson issued a formal statement.,0,0,0,0
The anchorman delivered the evening news with confidence.,1,0,0,0
Men don't like to ask for directions when lost.,0,1,0,0
The paper was submitted with the male researcher listed as corresponding author without her agreement.,0,0,0,1
The male librarian organized the archive section.,1,0,0,0
The paper used mailman exclusively and portrayed female postal workers as less reliable.,1,1,1,0
The brotherhood among the soldiers was evident.,1,0,0,0
Her data collection and analysis were used in the final publication without acknowledgment.,0,0,1,1
She was hired to meet the gender quota not because of her qualifications.,0,1,0,0
All freshman males in the study were given leadership roles while females were not.,1,0,1,0
The fireman was depicted as the true hero while female workers were shown as helpless.,1,0,1,0
Female participants in the study were primarily observed in domestic settings.,0,0,1,0
Boys are more competitive in academic settings than girls.,0,1,0,0
It was a manmade disaster that affected thousands.,1,0,0,0
The actress received a standing ovation after her performance.,1,0,0,0
The committee appointed four men and one woman to maintain balance.,0,0,1,0
James Wilson suggested that women lack the assertiveness needed for executive positions.,0,1,0,1
A good wife always ensures the house is clean when her husband returns.,0,1,0,0
The study used stewardess to describe all flight crew and portrayed them as naturally more nurturing than pilots.,1,1,1,0
The research questions guided the overall structure of the study.,0,0,0,0
"Marie Curie was an exception, as women are generally weaker in science and underrepresented in research leadership.",0,1,1,1
The research grant was awarded to the male applicant over equally qualified female candidates.,0,0,1,0
The women in the study were presented as outliers rather than representative of their field.,0,0,1,0
Women are physically weaker and should avoid demanding labor.,0,1,0,0
The study limitations include a small and geographically limited sample.,0,0,0,0
The bag lady sat outside the convenience store.,1,0,0,0
The lineman climbed the pole to restore power.,1,0,0,0
Women aren't really interested in high-level gaming.,0,1,1,0
Women are too emotional to handle high-pressure management positions.,0,1,0,0
Female researchers were described as having collected data while men were described as having generated knowledge.,0,0,0,1
The average man on the street would disagree with this policy.,1,0,0,0
Her contributions to the project were briefly mentioned in the acknowledgments section.,0,0,1,0
Men who stay at home to raise children are not fulfilling their role.,0,1,0,0
The team worked late to finish the project on time.,0,0,0,0
Men are better at parking due to spatial awareness.,0,1,0,0
The nomination for the award was submitted for her male colleague despite her superior publication record.,0,0,0,1
We would like a dominant figure as our leader.,0,0,0,0
Men were depicted as natural leaders while women were shown as better suited for support roles.,0,1,1,0
The citation patterns in the study reflected a strong preference for male-authored research.,0,0,1,0
Men are more competitive in high-stakes environments.,0,1,0,0
Rosalind Franklin's X-ray images were used without her knowledge or credit.,0,0,1,1
Einstein alone discovered nuclear fission.,0,0,0,1
The hostess welcomed each guest at the entrance.,1,0,0,0
The CEO arrived with his secretary who took notes.,0,1,0,0
Esther Lederberg's work on bacterial genetics was overshadowed by her husband's recognition.,0,0,1,1
Women are more sensitive and prone to crying than men.,0,1,0,0
Alice Ball developed a treatment for leprosy but the credit was given to a male colleague after her death.,0,0,1,1
Descriptive statistics were used to summarize demographic information.,0,0,0,0
The sample size consisted of 200 undergraduate students.,0,0,0,0
Edison invented the lightbulb through his own independent research.,0,0,0,1
Steve Jobs wrote the code for the first Apple computer.,0,0,0,1
The female subjects were described in terms of their physical appearance before their qualifications.,0,0,1,0
Thomas Garcia used the term freshman to describe all new students regardless of gender.,1,0,0,1
Female leaders are often perceived as being bossy.,0,1,0,0
Female academics in the study were described as collaborative while males were described as pioneering.,0,0,1,0
Men do not cry because they are naturally more stoic.,0,1,0,0
Men dominate STEM fields because they are naturally more analytical.,0,1,0,0
Firemen rushed into the burning building.,1,0,0,0
Women who contributed to the findings were listed under general acknowledgments.,0,0,1,0
Zelda Fitzgerald wrote many passages attributed to Scott.,0,0,0,1
Male researchers in the department published twice as many first-author papers as female researchers.,0,0,0,1
Women are naturally more social and talkative than men.,0,1,0,0
The businessman traveled to three countries in one week.,1,0,0,0
The default pronoun used throughout the study to refer to researchers was he.,0,0,1,0
"John Smith argued that mankind is naturally more rational, and his stewardesses proved less capable under pressure.",1,1,0,1
Firemen rushed into the building to save the occupants.,1,0,0,0
The institution's history of leadership shows an unbroken line of male directors.,0,0,1,0
The mailman assumed female residents needed extra help carrying their packages.,1,1,0,0
The fireman was portrayed as rational and heroic while the stewardess was shown as emotional and decorative.,1,1,1,0
Male doctors were shown as decisive while female doctors were portrayed as overly cautious.,0,1,1,0
The female researcher's hypothesis was central to the study but credited to her supervisor.,0,0,1,0
Women are more suited to teaching young children than men.,0,1,0,0
Every nurse must ensure she completes the patient log.,1,0,0,0
The research team consisted of three faculty members and two assistants.,0,0,0,0
Robert Johnson argued that women are naturally better suited for nursing than leadership.,0,1,0,1
Women are incapable of handling frontline combat.,0,1,1,0
Data was stored securely in accordance with privacy regulations.,0,0,0,0
Women are more patient with children because of their maternal instinct.,0,1,0,0
The common man struggles to understand tax laws.,1,0,0,0
The female team members were thanked informally but not credited as authors.,0,0,1,0
The paper follows the APA citation format throughout.,0,0,0,0
The doorman greeted guests as they entered the hotel.,1,0,0,0
Men are less emotional which makes them better in crisis situations.,0,1,0,0
When a child misbehaves his parents are usually informed.,1,0,0,0
Her paper was held to a higher standard of evidence than comparable papers by male authors.,0,0,0,1
Her contributions were absorbed into the project and credited to the team lead who was male.,0,0,1,1
The paper referred to all chairmen as natural leaders while chairwomen were overlooked.,1,0,1,0
Female professionals in the sample were identified by their family status more than their male counterparts.,0,0,1,0
The women in the laboratory were credited as assistants rather than co-investigators.,0,0,1,0
The waitress served the customers quickly.,1,0,0,0
The Wright Brothers invented flight with no external help.,0,0,0,1
Fleming discovered penicillin entirely on his own in his laboratory.,0,0,0,1
The Great Gatsby was purely the work of F. Scott Fitzgerald.,0,0,0,1
Findings were presented at an international academic conference.,0,0,0,0
The historical account of the movement centered male figures while erasing female organizers.,0,0,1,0
The handyman fixed the broken fence over the weekend.,1,0,0,0
Tables and figures were used to present quantitative findings clearly.,0,0,0,0
A policeman directed traffic at the busy intersection.,1,0,0,0
All students must submit their homework by Monday.,0,0,0,0
Men are not suited for roles requiring high empathy.,0,0,1,0
Every student must submit their assignment by Friday.,0,0,0,0
Men handle pain better than women because they are tougher.,0,1,0,0
Survey responses were gathered from participants aged 18 to 65.,0,0,0,0
Nettie Stevens discovered the XY sex-determination system.,0,0,0,1
